{
  "$schema": "https://json-schema.org/draft/2020-12/schema",
  "title": "Runlix Release JSON",
  "type": "object",
  "properties": {
    "image": {
      "type": "string",
      "pattern": "^ghcr\\.io/runlix/[a-z0-9]+([._-][a-z0-9]+)*$"
    },
    "version": {
      "type": [
        "string",
        "null"
      ],
      "minLength": 1
    },
    "sha": {
      "type": "string",
      "pattern": "^[a-f0-9]{40}$"
    },
    "short_sha": {
      "type": "string",
      "pattern": "^[a-f0-9]{7,40}$"
    },
    "published_at": {
      "type": "string",
      "pattern": "^\\d{4}-\\d{2}-\\d{2}T\\d{2}:\\d{2}:\\d{2}Z$"
    },
    "manifests": {
      "type": "array",
      "minItems": 1,
      "items": {
        "type": "object",
        "properties": {
          "tag": {
            "type": "string",
            "pattern": "^[A-Za-z0-9][A-Za-z0-9._-]*$"
          },
          "digest": {
            "type": "string",
            "pattern": "^sha256:[a-f0-9]{64}$"
          },
          "platforms": {
            "type": "array",
            "minItems": 1,
            "uniqueItems": true,
            "items": {
              "type": "string",
              "enum": [
                "linux/amd64",
                "linux/arm64"
              ]
            }
          }
        },
        "required": [
          "tag",
          "digest",
          "platforms"
        ],
        "additionalProperties": false
      }
    }
  },
  "required": [
    "image",
    "version",
    "sha",
    "short_sha",
    "published_at",
    "manifests"
  ],
  "additionalProperties": false
}
